{"$schema":"https://json-schema.org/draft/2020-12/schema","$id":"https://shockbridge-pulse.example/helix/contracts/routing.schema.json","title":"Routing Decision","type":"object","additionalProperties":false,"required":["request_id","intent","queue","urgency","out_of_scope_score","confidence","top_alternatives","decision","model_version"],"properties":{"request_id":{"type":"string","format":"uuid"},"intent":{"type":["string","null"]},"queue":{"type":["string","null"]},"urgency":{"enum":["low","normal","high","critical"]},"out_of_scope_score":{"type":"number","minimum":0,"maximum":1},"confidence":{"type":"number","minimum":0,"maximum":1},"top_alternatives":{"type":"array","maxItems":3,"items":{"type":"object","additionalProperties":false,"required":["intent","queue","probability"],"properties":{"intent":{"type":"string"},"queue":{"type":"string"},"probability":{"type":"number","minimum":0,"maximum":1}}}},"decision":{"enum":["ANSWER_WITH_EVIDENCE","AUTO_ROUTE","RECOMMEND_TO_AGENT","ASK_FOR_CLARIFICATION","ESCALATE_LOW_CONFIDENCE","ESCALATE_OUT_OF_SCOPE","ESCALATE_CONFLICTING_EVIDENCE","ESCALATE_SAFETY_RISK","ESCALATE_SYSTEM_FAILURE"]},"reason_code":{"type":["string","null"]},"model_version":{"type":"string","minLength":1}}}
