{
  "request_id": "00000000-0000-4000-8000-000000000001",
  "intent": "card_arrival",
  "queue": "cards_and_access",
  "urgency": "normal",
  "out_of_scope_score": 0.03,
  "confidence": 0.91,
  "top_alternatives": [
    {
      "intent": "card_delivery_estimate",
      "queue": "cards_and_access",
      "probability": 0.07
    }
  ],
  "decision": "AUTO_ROUTE",
  "reason_code": null,
  "model_version": "fixture-router-v0"
}
